<?xml version="1.0" encoding="UTF-8"?>
<!DOCTYPE assessment_treatment_history SYSTEM "assessment_treatment_history.dtd">
<assessment_treatment_history>
<id>ff0e8400-e29b-41d4-a716-44665544000a</id>
<assessment_id>660e8400-e29b-41d4-a716-446655440001</assessment_id>
<previous_psychiatric_diagnosis>yes</previous_psychiatric_diagnosis>
<previous_diagnoses></previous_diagnoses>
<previous_therapy>yes</previous_therapy>
<therapy_type>cbt</therapy_type>
<therapy_details>Example text.</therapy_details>
<previous_psychiatric_admission>yes</previous_psychiatric_admission>
<admission_count>2</admission_count>
<admission_details>Example text.</admission_details>
<crisis_team_involvement>yes</crisis_team_involvement>
<sectioned_under_mental_health_act>yes</sectioned_under_mental_health_act>
<section_details>Example text.</section_details>
<electroconvulsive_therapy>yes</electroconvulsive_therapy>
<treatment_response>Example treatment</treatment_response>
<treatment_history_notes>Example text.</treatment_history_notes>
<created_at>2026-04-09T10:00:00Z</created_at>
<updated_at>2026-04-09T10:00:00Z</updated_at>
</assessment_treatment_history>
